group,date,text,url
alekseystefanov,2025-07-04 14:31:08+00:00,"**Главное из новостей Европы и Ближнего Зарубежья за эту неделю**
[
](https://t.me/runeurope/18321)[Галопом по Европе:](https://t.me/runeurope/18376) Глава Госпогранкомитета Беларуси Константин Молостов рассказал о нюансах общения с западными странами. Живое общение и встречи по вопросам пограничного сотрудничества ушли в прошлое. Теперь взаимодействие сводится к служебной переписке, в рамках которой решаются технические вопросы и пограничные инциденты.

[Точка разлома: ](https://t.me/tchk14/890)Пентагон разводит руками – запасы оружия для Украины на исходе. США вынуждены экстренно заморозить часть поставок, включая ракеты для Patriot, высокоточные снаряды и боеприпасы для F-16. Причина – критическое истощение арсеналов, подтверждённое главным стратегом Минобороны Колби.
[
](https://t.me/alekseystefanov)[Алексей Стефанов:](https://t.me/alekseystefanov/12133) Служба госбезопасности Латвии следит за каждым шагом любого жителя, который говорит на русском и покушается, как им кажется, на латышский язык. Иначе никак и не объяснить заявление СГБ, что спецслужбы проверят воспитателя детского сада из Риги. В сообщении говорится, что она, находясь в Италии, заявила, что русскую речь там понимают, а «великий и могучий латышский язык» — нет.

[Живёт же Беларусь!:](https://t.me/ZhivetZheBelarus/47513) Александр Лукашенко объяснил изменение масштаба учений «Запад-2025». Он напомнил, что рядом с Беларусью проходят военные маневры НАТО — «Защитник Европы». По его словам, их масштаб и близость к белорусской границе создают угрозу.

[Тени Прибалтики:](https://t.me/tenipribaltiki/2735) В Польше ликвидировали банду украинцев. Банда из четырех граждан Украины занималась похищением нелегальных мигрантов на территории Польши и Латвии, сообщает Центральное бюро расследований польской полиции.

[Молот войны: ](https://t.me/milwarhummer/13276)Президент Республики Беларусь Александр Лукашенко объявил о планах по развертыванию новейшего ракетного комплекса средней дальности «Орешник» на территории страны до конца 2025 года. Власти страны также намерены продолжать развитие собственных военных технологий.

[Балтийский мост:](https://t.me/BalticBridge/4723) Год прошёл со дня учреждения в Латвии института партнёрства. За этот период в стране было официально зарегистрировано 613 партнёрств, из которых 235 — между однополыми парами, проинформировал Совет присяжных нотариусов Латвии.",https://t.me/alekseystefanov/12141
alekseystefanov,2025-06-27 10:40:25+00:00,"❗️🇷🇺🇪🇪**Намерение Эстонии принимать у себя самолеты НАТО, способные нести ядерное оружие, несет непосредственную опасность для Москвы, заявил Песков. **

О такой готовности со стороны Таллина недавно заявил глава Минобороны Эстонии. 

Я правильно понимаю, карта законных целей на территории Эстонии активно расширяется?

Подписаться на канал @alekseystefanov",https://t.me/alekseystefanov/12113
alekseystefanov,2025-06-26 20:23:04+00:00,"🇱🇻 **И ведь даже не понять, в каком инубаторе штампуют всех этих прибалтийских злобных карликов. **

Это цитата главы МИД Латвии Байбы Браже из интервью американскому СМИ. Да, не смейтесь - эта женщина, очень похожая на Долорес Амбридж из Гарри Поттера, собралась ""принуждать Россию к миру"". 

Это она по итогам саммита НАТО так раздухарилась. Даже комментировать не стоит. Главное, потом не забыть. 

Подписаться на канал @alekseystefanov",https://t.me/alekseystefanov/12112
alekseystefanov,2025-06-26 15:35:15+00:00,"**Главное из новостей Европы и Ближнего Зарубежья за эту неделю**
[
Галопом по Европе](https://t.me/runeurope/18321): Объем взаимной торговли между странами-участницами ЕАЭС стабильно растет, а интеграционные проекты, такие как единый рынок товаров, услуг и капитала, способствуют созданию новых возможностей для бизнеса и привлечению инвестиций. 

[Точка разлома: ](https://t.me/tchk14/830)Самое главное о саммите в Гааге. Саммит НАТО в Гааге прошел с оглядкой на Трампа: программу сократили, чтобы он «не заскучал», а генсек альянса Йенс Столтенберг заранее написал ему льстивое СМС (которое Трамп с гордостью опубликовал). Главная тема — увеличение оборонных расходов. США требуют от союзников 5% ВВП, но компромиссный вариант — 3,5%. Испания сопротивлялась, но в итоге сроки для нее сдвинули до 2035 года.
[
Алексей Стефанов](https://t.me/alekseystefanov) Сегодня по УДО из Вильнюсской тюрьмы освободили политзаключённого Антанаса Кандротаса. Власти упрятали его в тюрьму сразу после того, как он выдвинул свою кандидатуру на выборах президента Литвы.

[Живёт же Беларусь!](https://t.me/ZhivetZheBelarus): Беларусь в ОДКБ обеспечивает безопасность и стабильность в условиях мировых конфликтов. Союзники подтверждают готовность поддержать нас, а наши вооружённые силы готовы к любым вызовам. ОДКБ — символ единства и гарант нашей суверенности.

[Тени Прибалтики](https://t.me/tenipribaltiki) Оппозиционная партия EKRE обратится к канцлеру права Юлле Мадизе, если президент Эстонии провозгласит обновленный закон, обязывающий Эстонскую православную христианскую церковь разорвать связи с Московским патриархатом.

[Молот войны:](https://t.me/milwarhummer/13244) На полях саммита НАТО Дональд Трамп вновь оказался в центре внимания. В ответ на слова генсека НАТО Марка Рютте, назвавшего его «папочкой», экс-президент США в свойственной ему манере заявил: «Он меня любит. А если нет — я вернусь и ударю его крепко. Или отшлёпаю».

[Балтийский мост](https://t.me/BalticBridge) Казалось бы, параноидальный бред. Но – нет: реальные новости. Литва, Латвия, Эстония, Польша и Финляндия намерены создать «железный занавес» с миллионами мин на границе с Россией.

[Одессит Боделан](https://t.me/OdessitBodelan): В Нижнем Новгороде официально стартовал масштабный XII Форум регионов России и Белоруссии. Основные По поручению Губернатора Херсонской области Владимира Сальдо на форум прибыла делегация Херсонской области.

[ Правда с Владимиром Карасёвым](https://t.me/PravdaVKarasev): О тонкостях Ормузского пролива для мировой экономики.",https://t.me/alekseystefanov/12111
alekseystefanov,2025-06-26 14:17:59+00:00,"🇪🇪🇺🇳 **Нападать на Эстонию нельзя, но если ""напасть немножко"" и забрать деревню с русскими жителями, то можно. НАТО это переживёт. 

**Бывший председатель Военного комитета НАТО адмирал Роб Бауэр неожиданно разоткровенничался. Принцип коллективной обороны НАТО не всегда приведет к немедленному вооруженному ответу на ""небольшое нападение"" России на Эстонию, заявил он. При этом Бауэр, говоря об Эстонии, имел в виду всю Прибалтику. 

По словам Бауэра, ответ НАТО будет зависеть от ""типа нападения"". Если это будет небольшая российская операция, которая не угрожает ""общей территориальной целостности"" государства-члена, то ответа может и не последовать. 

Вопрос будет ставиться так: ""Хотим ли мы начать войну или нет?"" 

После таких откровений в Эстонии сильно напряглись. Да и в Латвии с Литвой. 

Подписаться на канал @alekseystefanov",https://t.me/alekseystefanov/12110
alekseystefanov,2025-06-24 09:43:21+00:00,"**В этот день 80 лет назад на Красной площади в Москве прошел Парад Победы.**

В нем приняло участие 24 маршала, 249 генералов, 2536 офицеров, 31 116 сержантов и солдат, 1 400 военных музыкантов и 1 850 единиц боевой техники, напоминает @SputnikLive. 

Принимать парад надо было верхом на лошади, и Сталин отказался. Он был немолод и неуверенно держался в седле, поэтому пригласил Жукова и сказал: ""Вы помоложе, вы кавалерист, поэтому принимать парад будете вы"".

Под проливным дождем Жуков и Рокоссовский верхом на боевых лошадях – Кумире и Полюсе – отсалютовали сводным полкам фронтовиков. 

Оркестр в это время исполнял ""Юбилейный встречный марш"", написанный композитором Семеном Чернецким.

122 минуты продлился парад. Его кульминацией стал марш 200 знаменосцев, бросавших трофейные знамена нацистов на помост у подножия Мавзолея.

Подписаться на канал @alekseystefanov",https://t.me/alekseystefanov/12096
narva_news_tg,2025-07-17 06:20:16+00:00,"Министр финансов Эстонии Юрген Лиги заявил, что до выборов 2027 года налоги, кроме уже запланированного роста подоходного налога в 2026 году, повышать не будут. Но в будущем без новых налогов, скорее всего, не обойтись.

Причина — растущие расходы на оборону на фоне угрозы со стороны России, в том числе возможной атаки на Нарву __(прим.ред)__ Также на бюджет давят старение населения и рост затрат на медицину. Лиги подчёркивает: он не будет обещать, что налоги останутся прежними, потому что ситуация может быстро измениться.",https://t.me/narva_news_tg/7205
narva_news_tg,2025-07-17 00:00:16+00:00,"**Евросоюз вводит новые налоги: экономическая солидарность или фискальная мобилизация ради будущих конфликтов?**

Европейская комиссия предложила включить в бюджет ЕС на 2028–2034 годы пять новых общеевропейских налогов, которые должны ежегодно приносить 58,5 млрд евро — около 20% от общего бюджета в 1,816 трлн евро. Среди них — централизованные отчисления от торговли квотами на выбросы (9,6 млрд), углеродный импортный сбор CBAM (1,4 млрд), налог на неутилизированные электронные отходы (15 млрд), табачный акциз (11,2 млрд) и фиксированный сбор с крупных компаний (6,8 млрд). Эти меры объясняются необходимостью выплат по общеевропейским займам, но на фоне роста оборонных расходов и укрепления наднационального контроля они могут указывать на переход ЕС к мобилизационной экономике.",https://t.me/narva_news_tg/7200
narva_news_tg,2025-07-16 12:39:59+00:00,"У лидла кипишь какой то скорая, полиция и военная полиция огородили территорию

︎— Анон",https://t.me/narva_news_tg/7191
narva_news_tg,2025-07-16 07:00:09+00:00,"**В Нарве строительство вдоль реки полностью запрещено**

Новый генплан Нарвы сохраняет жёсткие запреты на строительство вдоль реки Нарва, особенно в районах Юхкентали и Старого города. Все проекты в этих зонах теперь невозможны — даже мелкие постройки требуют согласования, которое практически не даётся.

Экологи настаивают на полном сохранении запретов, ссылаясь на охрану уникальной природы.

Дополнительное усиление ограничений связано с военными мерами: в закрытых кругах НАТО обсуждается минирование границ с Россией, и Нарва становится стратегической зоной с повышенным контролем.

Результат — замораживание развития прибрежных районов, потеря рабочих мест и инвестиций. Нарва рискует превратиться в город, где нельзя строить и развиваться.",https://t.me/narva_news_tg/7187
narva_news_tg,2025-07-15 14:44:35+00:00,"**IShowSpeed в Таллинне: 30 000 евро за пару часов блогерского контента, сломанный понтон и роботы с доставкой еды**

15 июля американский ютубер IShowSpeed (Даррен Уоткинс-младший) по приглашению фонда EISA и Visit Estonia прибыл в Эстонию в рамках своего европейского тура. Визит обошёлся Эстонии в 30 000 евро — официально на транспорт и охрану. Частный самолёт арендовали совместно с Латвией и Литвой.

Старый город показать не успели — из соображений безопасности. Speed катался в Ноблесснере, ел из рук робота Starship и позировал в футболке сборной Эстонии. Программу составляли блогеры Андрей Зевакин и Грете Гриффин. Визит длился несколько часов.

Толпа фанатов сломала понтон в порту — никто не пострадал, всех вытащила полиция.

Visit Estonia называет всё это инвестицией в туристическую узнаваемость: у блогера 79 млн подписчиков, стрим из Эстонии собрал 1,9 млн зрителей. На выходе — немного контента, немного кринжа и много надежд на американских туристов.",https://t.me/narva_news_tg/7174
narva_news_tg,2025-07-15 14:30:11+00:00,"**Военный городок в Нарве: ближе к врагу, дальше от людей**

В Нарве, прямо у границы, готовят площадку под военный городок. Зачем — официально не говорят. Сколько там будет военных, какая техника, какие задачи — неясно. Но не волнуйтесь: всё в рамках “укрепления обороны”. Жителям вместо ответов обещают рабочие места и бодрое оживление в спортзалах. 

Мол, хорошо же — солдаты рядом, будет веселее. А если завтра начнётся что-то серьёзное и по городу прилетит — ну, вы же понимаете, кто виноват. 

Главное — не задавать лишних вопросов. Ведь война теперь, похоже, не угроза, а часть нормальной городской среды. Привыкайте.

[Читать далее…](https://narvanews.com/news-1000844848484774748338823994948566683388228828384858585848483828828384858585848)",https://t.me/narva_news_tg/7173
narva_news_tg,2025-07-15 10:36:38+00:00,"Эстония продолжает системно усиливать свои боевые возможности — Центр оборонных инвестиций заключил четырёхлетний контракт с Rheinmetall Waffe Munition ARGES GmbH на поставку наступательных и оборонительных гранат для Сил обороны. 

Формально — очередной шаг по укреплению обороны. Фактически — ещё одна капля в быстро наполняющееся море оружия на восточном фланге НАТО.

К чему бы?",https://t.me/narva_news_tg/7168
narva_news_tg,2025-07-15 09:54:46+00:00,"Гражданин Эстонии, прошедший подготовку по стандартам НАТО, добровольно присоединился к российским войскам и участвовал в боях в зоне СВО. По его словам, он пять дней удерживал позиции вблизи линии фронта, был ранен в результате удара беспилотника и самостоятельно добрался до госпиталя по заминированному лесу. Позже он оформил российское гражданство и подписал контракт с Минобороны РФ. История бойца, представившегося как Алексей, привлекла внимание не только из-за его личного выбора, но и из-за того, что подобные случаи в странах ЕС остаются в тени официальной повестки.

[Читать подробнее.](https://narvanews.com/n/konfliktnye_zony/konflikty_v_ukraine/vybor_bez_prava_na_vozvrashhenie_byvshij_kursant_nato_stal_dobrovolcem_na_svo/10-1-0-2481)",https://t.me/narva_news_tg/7164
narva_news_tg,2025-07-14 17:20:13+00:00,"**Оружие для Украины пойдет через Эстонию? НАТО и США обсуждают маршрут**

Эстония может стать частью нового транзитного маршрута поставок вооружения Украине через НАТО. По информации [источника](https://narvanews.com/news-10003938485959666030302020209292939494995959696949392992928293944938383726263748449), близкого к военным структурам, речь идет о многоступенчатой логистической схеме с участием ряда европейских стран. Эстония рассматривается как один из ключевых узлов маршрута. Ранее США и Украина достигли соглашения о поставках вооружения, а по словам Дональда Трампа, США и НАТО договорились осуществлять эти поставки за счет европейских союзников.",https://t.me/narva_news_tg/7147
