group,date,text,url
news_lv,2025-07-17 06:03:13+00:00,"🇺🇦🇱🇻🇵🇱🚍**ТЦК используют для мобилизации в ряды ВСУ автобусы с номерами Латвии и Польши**

ТЦК на Украине используют автобусы с иностранными номерами, обычно Латвии или Польши, для проведения насильственной мобилизации, рассказал РИА Новости пленный военнослужащий ВСУ из Львова Петр Климишевский. 

""Бусификация это называется. Ездит бусик с иностранными номерами. Обычно либо Латвия, либо Польша. В бусике присутствуют до пяти ""быков"", - рассказал пленный. 

По его словам, в последнее время в машине также ездит полицейский, чтобы людям было сложнее ""отбиться"".
Пленный добавил, что мобилизация во Львове усилилась в последние полтора года. ""Последнее время людей прямо похищают с улицы"", - сказал он.

@news_lv",https://t.me/news_lv/55762
news_lv,2025-07-16 17:42:05+00:00,"**🇱🇹🧨 В Литве взрывают бункеры для тестов**

На полигоне имени генерала Сильвестраса Жукаускаса в Пабраде со вторника проводятся испытания бункеров различных типов путем их подрыва, сообщили в литовской армии.

По словам военных, они имитируют ""стандартные российские артиллерийские снаряды"" путем подбора необходимого взрывчатого вещества, а затем определяются давление, звук, вибрация стен в бункере и другие параметры, возникающие при взрыве

""Это делается для того, чтобы выяснить, защищает ли бункер, который на первый взгляд может казаться неповрежденным во время атаки, находящийся в нем личный состав, и, принимая во внимание результаты и затраты на возведение бункеров, определить наиболее подходящие материалы для возведения такого типа укрытия для солдат"", — подчеркивают военные.

@news_lv",https://t.me/news_lv/55755
news_lv,2025-07-16 15:54:01+00:00,"**📸🌹В Кемери сейчас такая красота **

В городском парке перед бывшим санаторием Ķemeri цветут 2550 кустов роз. 

@news_lv",https://t.me/news_lv/55743
news_lv,2025-07-16 08:04:01+00:00,"🇪🇺🇺🇸🇺🇦**Каллас заявила, что раз Европа заплатит США за оружие для Киева, то это - не американская помощь**

Глава евродипломатии Кая Каллас заявила, что если ЕС платит за американское оружие, то это европейская поддержка, и что США должны разделить “бремя”вооружения Украины.

""Если вы обещаете предоставить оружие, но говорите, что за него заплатит кто-то другой, то на самом деле вы его не предоставляете"", - сказала Каллас.

Президент США Дональд Трамп 11 июля объявил, что НАТО будет платить за американское оружие, которое альянс будет поставлять Украине. В понедельник он сообщил, что будущие поставки военной помощи киевскому режиму будут включать батареи Patriot, при этом некоторые страны передадут Киеву имеющиеся у них системы ПВО Patriot, а Америка восполнит их арсеналы новыми комплексами.

@news_lv",https://t.me/news_lv/55718
news_lv,2025-07-15 15:25:08+00:00,"**Ринкевичс получил медаль от президента Косово**

Во вторник президент самопровозглашенного Косово Вьоса Османи-Садриу вручила президентскую военную медаль Национальным вооруженным силам (НВС) Латвии за вклад в укрепление мира и безопасности в ходе миротворческой операции НАТО в Косово (KFOR).

Латвия регулярно отправляет в Косово своих солдат, да и сам Ринкевичс любит [наведываться](https://t.me/news_lv/49996) в страну в гости.

Напомним, НАТО нарастила свой контингент в Косово после обострения в регионе в конце 2023 года, когда в результате вооруженного нападения погиб один из косовских силовиков.

Президент Сербии Александр Вучич позднее пояснил, что косовские полицейские убили трех сербов, а представители натовского контингента фактически помогали местной полиции в операции против сербов.

Вучич подчеркнул, что после этого инцидента Белград никогда не признает независимость Косово.

@news_lv",https://t.me/news_lv/55696
i20028843,2025-07-17 12:22:46+00:00,"🚨🚨🚨 IMPORTANT : The commander of the U.S. Army in Europe and Africa and commander of NATO ground forces, Christopher Donahue, says the alliance has planned operational suppression of the defensive potential of Russian forces in the Kaliningrad region.

If you look at the Kaliningrad region..., it is surrounded by NATO countries on all sides. 
There is absolutely no reason why, in order to deter Russia, we cannot suppress the A2AD (Anti-Maneuver and Access Area) zone from the ground... faster than we ever could. 
We have already planned and developed (the necessary potential),"" he said, speaking at a conference in Germany🚨🚨🚨",https://t.me/i20028843/254036
i20028843,2025-07-17 04:57:33+00:00,⚡️⚡️⚡️Colombia's President Gustavo Petro said he wants his country to renounce its global partnership with NATO⚡️⚡️⚡️,https://t.me/i20028843/253988
i20028843,2025-07-16 19:50:41+00:00,"⚡️😂⚡️A State Department spokeswoman Tammy Bruce declined to answer reporters' question about how many NATO members have given consent to pay for additional U.S. arms supplies to Ukraine

I will not discuss what we can or cannot discuss or diplomatic discussions. 
I'm certainly not in a position to discuss what the NATO leadership might say.

Pentagon spokesman Sean Parnell reported Tuesday that the agreement for U.S. arms supplies to Ukraine with European money is still at a ""very early stage⚡️😂⚡️",https://t.me/i20028843/253955
i20028843,2025-07-16 17:00:36+00:00,"⚡️⚡️⚡️Financial Times reported that Taiwan's military has begun urban combat training against Chinese military forces.

Units have been ""holding the defense"" directly in the streets of the capital to better prepare for a possible attack by China and raise public awareness of what such a crisis would entail. 
At dawn, a squad of military police armed with Javelin anti-tank missile systems emerged from Taipei's subway station and, running past closed storefronts, took up combat positions.

In other parts of the city, the army's logistics support command used the high-speed public transportation system to deliver ammunition and supplies from the eastern district⚡️⚡️⚡️",https://t.me/i20028843/253941
slavaded1337,2025-07-17 10:21:57+00:00,"**Молдавский политик Ренато Усатый заявил, что власти Молдовы согласовывают приезд в страну российских артистов с главой офиса президенты Украины (!!!) Ермаком, передает издание Point.**

__""Я лично разговаривал с премьер-министром Речаном по телефону. Он мне сказал, для того, чтобы группа ""Руки вверх"" и другие заехали в страну, нужно выйти на Андрея Ермака, главу Офиса президента Украины. Если он скажет, тогда мы запустим, по-другому мы не запустим. Мне дана была рекомендация согласовать въезд артистов с Андреем Ермаком и со спецслужбами других стран"", - заявил Ренато Усатый.__

[Дядя Слава. Подписаться.](https://t.me/+RqE-P04Bypbunkq-)",https://t.me/slavaded1337/79995
slavaded1337,2025-07-17 09:20:06+00:00,"**Мобилизация во Львове**

Парень вышел из квартиры выгулять собаку, тут в подъезде его и схватили.

[Дядя Слава. Подписаться.](https://t.me/+RqE-P04Bypbunkq-)",https://t.me/slavaded1337/79992
slavaded1337,2025-07-17 08:21:29+00:00,"По нашему бойцу ударил FPV дрон, но не сдетонировал. 

После этого солдат взял дрон и пошел бить его об дерево. Ибо нефиг.

[Дядя Слава. Подписаться.](https://t.me/+RqE-P04Bypbunkq-)",https://t.me/slavaded1337/79987
slavaded1337,2025-07-16 13:22:36+00:00,"Армия обороны Израиля заявляет: «Мы готовимся к нескольким дням боев с сирийской армией».

[Дядя Слава. Подписаться.](https://t.me/+RqE-P04Bypbunkq-)",https://t.me/slavaded1337/79965
slavaded1337,2025-07-16 06:56:43+00:00,"**«Если Путин и другие интересуются, что произойдет на 51-й день, я бы посоветовал им позвонить аятолле», — американский сенатор пригрозил России повторением судьбы Ирана, если Кремль проигнорирует ультиматум Трампа**

🤡

[Дядя Слава. Подписаться.](https://t.me/+RqE-P04Bypbunkq-)",https://t.me/slavaded1337/79934
zeradaglobal,2025-07-15 19:11:45+00:00,"🇺🇸🧩🇷🇺 **Reuters**: __President Vladimir Putin intends to keep fighting in Ukraine until the West engages on his terms for peace, unfazed by Donald Trump's threats of tougher sanctions, and his territorial demands may widen as Russian forces advance.

Putin's conditions for peace include a legally binding pledge that NATO will not expand eastwards, Ukrainian neutrality and limits on its armed forces, protection for Russian speakers who live there, and acceptance of Russia's territorial gains. He is also willing to discuss a security guarantee for Ukraine involving major powers, though it is far from clear how this would work. 

Despite several telephone calls between Trump and Putin, and visits to Russia by U.S. special envoy Steve Witkoff, the Russian leader believes there have not been detailed discussions of the basis for a peace plan__. 

**This is mostly accurate. We'll add that complete disregard is unlikely - Russia will certainly make a counterproposal☝️**",https://t.me/zeradaglobal/4152
zeradaglobal,2025-07-15 11:21:31+00:00,"🇫🇷🔥🇷🇺 **France's National Strategic Review states:**

""__The hypothesis of new Russian aggression against Europe within the next three to five years is central to continental defense and security interests. Potential offensive actions could target Ukraine anew, or occur near Europe - in Moldova, the Balkans, or even against NATO member states to test Alliance cohesion. The highest-risk scenario involves such aggression coinciding with large-scale operations in another global region, diverting American forces__.""

**Thus, the assumption that Russia will attack European countries within 3-5 years is becoming normalized.**",https://t.me/zeradaglobal/4143
zeradaglobal,2025-07-14 19:28:13+00:00,"🛁🛁🛁 **About That ""Warm Bath""**

Over six months ago, we started writing that Europe was actively preparing for direct war with Russia. Now, news about this pours in daily:

✅ The UK Defense Minister declares the island is preparing for direct confrontation with Russia;

✅ Macron suddenly doubles the military budget, moving the target from 2030 to 2027;

✅ Poland starts sending draft notices for medical examinations to hundreds of thousands of citizens.

Back then, almost no one was thinking about this. It often happens this way—media figures are among the first to notice shifts in the narrative being broadcast to the public. We noticed that the West had begun sending its society a message: **""We must prepare for war with Russia.""**

What surprised us, however, was something else. Now that NATO countries’ increased military spending is a done deal, Russian—and even Belarusian—channels and ""Thought Leaders"" have SUDDENLY (likely after receiving the appropriate talking points) begun pushing the thesis: ""**There won’t be a war with the West—it’s simply impossible**.""

**And they’re using some hilariously weak arguments:**

🔹 Ordinary Europeans aren’t ready and won’t be ready for war with Russia in 5 or even 10 years. **This thesis is just defective. Before 2013, almost NO ONE in Ukraine was ready to fight either. The key is simply to start;
**
🔹 All the money the West allocates for war preparations will be stolen (alternate version: there won’t be enough money due to the high cost of living in the EU), and the media hype around war is just a ploy by certain individuals to get their hands on the trough. **This argument is partially true. Some funds will indeed be embezzled—just like Ursula von der Leyen did with Covid vaccines. And yes, the war hype is partly driven by the European defense industry’s lobbying.
**
**But that doesn’t change the fact that preparations are happening—and expanding VERY quickly. In 3-5 years, the British, Germans, French, and Poles will be far more prepared and better equipped than they are now.**

🔹 Such a conflict is impossible because it would immediately go nuclear, and Europeans don’t want to die.

**First, globalists are experts at ""slow-boiling the frog"". The war in Ukraine has shown that you CAN hit the Kremlin with a drone, CAN strike Russia’s missile warning radars, CAN attack an element of its nuclear triad, CAN even cross into Kursk Oblast—and no nuclear strike follows.

Second, who said the conflict would start head-on with the full might of NATO? We, too, began with a ""modest"" Anti-Terrorist Operation…

Third, Ukrainians also didn’t want (and still don’t want) to die in war. With the right level of control (including information control), the opinions of ordinary people don’t matter. The EU’s ""elites"" will decide everything. And notice—most of them don’t even have children☝️

So this Russian blogosphere’s attempt to lull the population into complacency is, at the very least, strange—especially when the military trajectory of events is becoming more obvious by the day.**",https://t.me/zeradaglobal/4139
zeradaglobal,2025-07-14 17:58:01+00:00,"🧩🧩🧩 **The mountain in labour** 

Trump's ""major announcement"" on Russia turned out to be MUCH weaker than even we expected (though we did predict it would be a dud).

1️⃣ **Special treatment for Russia:** While with other countries Trump first imposes new tariffs and then negotiates, Russia gets exclusive treatment—the 100% sanctions were announced upfront but postponed for 50 days. 

2️⃣ **Formally, the U.S. is ""less at war"" with Russia**: Trump is effectively using NATO as a middleman. The U.S. sells weapons to the EU, NATO distributes them (including to Ukraine). This way, in talks with the Russians, they can say, ""The U.S. isn’t supplying Patriots to Ukraine."" Another sign of special treatment—keeping business options open. Biden didn’t bother with such tricks.

3️⃣ **About the 17 Patriots for Europe—details still pending**: The U.S. won’t produce 17 systems quickly; it’ll take years. So, EU countries likely won’t transfer their currently deployed systems to Ukraine right away. Plus, the big question: Even if there are 100 launchers, what about the missiles for them???

4️⃣ Not a word about long-range missiles or other offensive weapons 🤷‍♂️

**The Russian stock market even went up on this announcement. The only one impressed by the ""world’s policeman"" was NATO Secretary-General Rutte—but he’s only in his job because of his ""silver tongue.""

Russian media jokes: ""Trump gave Russia 50 days to crush Ukraine. If they fail—he’ll impose sanctions...""**",https://t.me/zeradaglobal/4138
zeradaglobal,2025-07-14 16:36:48+00:00,"🇺🇸 **Trump's statements:**

**On sanctions**: __Based on that, we’re going to be doing secondary tariffs if we don’t have a deal in 50 days, it’s very simple. They’ll be at 100%, and that’s the way it is.__

**On weapons**: ""__We made a deal today where we are going to be sending them [Ukraine, - Ed.] weapons and they [Europe, - Ed.] will pay for.""
__
According to Trump, NATO and U.S. Permanent Representative to the Alliance Whitaker will coordinate deliveries of American weapons to Ukraine.

17 Patriot systems are being prepared for deployment to Europe, with a significant number of these systems destined for the battlefield.

**On Russia:** ""__The only one we still haven't been able to reach is Russia.""__",https://t.me/zeradaglobal/4136
zeradaglobal,2025-07-14 08:29:45+00:00,"🧩🧩🧩 **Trump's Dilemma:**

1️⃣ **Senator Lindsey Graham couldn't resist and spilled the beans to CBS News about what to expect from Trump's upcoming war announcement:**

🔹 __So, I don't want to get ahead of the President, but stay tuned about seized assets. The Europeans want to limit the interest on the assets to go to Ukraine. Secretary Bessent wants to go further__;

🔹 __America will begin to sell to our European allies tremendous amounts of weapons that can benefit Ukraine.

I expect, in the coming days, you will see weapons flowing at a record level to help Ukraine defend themselves;
__
🔹 __Congress is on the verge of passing the most consequential sanction package in the history of the- of the country. It will give President Trump tools he doesn't have today, a literal sledgehammer. And the big offenders here is China, India, and Brazil. India buys oil from Russia cheap and resells it. That's despicable. I've talked to President Trump. He said last week, it's time to move.__

Trump wants ""__to entice Putin to the table. But my goal is to end this war, and the only way you're going to end this war is to get people who prop up Putin make them choose between the American economy and helping Putin.""__

**Exactly as we previously** [**described**](https://t.me/zeradaglobal/4114). **Weapons supplies to Ukraine funded by EU and a sanctions ""sledgehammer"". We called it a ""club"" in our post, but the essence remains the same.**

2️⃣** According to Wall Street Journal, Deputy Defense Secretary Elbridge Colby wrote a secret memo to the US Defense Secretary warning that Ukraine's weapons requests could deplete American stockpiles**.

Allegedly this memo is why Hagerty previously blocked air defense missile supplies to Ukraine:

🔹 Colby advocated reorienting the US military to counter China;

🔹 Colby believes priorities must be set: ""**Let's give priority to the main threat even if that means we have to accept trade with other regions""**__;
__
🔹 **This approach stems not from indifference to other conflicts but from concerns that the US lacks resources for a three-front war (Europe, Middle East, China).

These were the two options Trump had to choose between. Whether to follow Biden's path of continuing to fight Russia while China keeps overtaking the US.

It's just like a ""three-way duel"". Of course the strongest can defeat the weakest, but in doing so he's guaranteed to lose to the second strongest 🤷‍♂️**",https://t.me/zeradaglobal/4132
zeradaglobal,2025-07-11 11:35:17+00:00,"🔥 **And Just to Ensure Putin Definitely Doesn’t Agree to Any Ceasefire, Globalists Keep Cooking Up New Initiatives

In Paris, a headquarters for multinational forces will be established, ready for rapid deployment on Ukrainian territory after hostilities end**: __""European allies step up plans for future Ukraine stabilization force, with US attending meeting.""__

The contingent will be called the Multinational Force Ukraine (MFU). In its first year, its headquarters will operate in Paris before relocating to London. A coordination unit in Kyiv is also planned. The exact list of participating countries hasn’t been disclosed, but it’s claimed that around 30 nations (excluding the U.S.) are involved.

At the same time, no concrete commitments were announced, and U.S. senators have ruled out any plans to deploy American troops to Ukraine.

**The whole point is to create a situation where the mere risk of foreign troop deployment in the event of a ceasefire takes the ceasefire off the table entirely. Nobody is actually planning to send anyone — just lowering the chances of a truce, which globalists (and now Trump’s team) insist on…**",https://t.me/zeradaglobal/4117
zeradaglobal,2025-07-11 07:44:21+00:00,"🧨 **Trump Armed to the Teeth**

The U.S. President is preparing to adopt a tougher stance toward Russia:

1️⃣ The scheme for arms deliveries to Ukraine’s Armed Forces will change: the U.S. sells, NATO buys and transfers to Ukraine. Trump:

""We're sending weapons to NATO, and NATO is paying for those weapons, 100%. So what we’re doing is the weapons that are going out are going to NATO, and then NATO is going to be giving those weapons (to Ukraine), and NATO is paying for those weapons. We send weapons to NATO, and NATO is going to reimburse the full cost of those weapons.""

**This is a major victory for globalists and Zelenskyу. For now, it suits them. Better American weapons for money than no weapons at all.

Trump can tell his voters that the U.S. is no longer paying for this war—on the contrary, it’s profiting from it. The question remains about production capacity (e.g., there aren’t enough air defense missiles for a conflict of this scale), but both the U.S. and the EU are working to expand their defense industries.**

2️⃣ There’s also progress on sanctions against Russia. They are coming, and Trump will have personal authority to impose or lift them:

""It’s a bill that the Senate is passing that very respectfully lets the president do whatever he wants.  They’re going to pass a very major and very biting sanctions bill, but it’s up to the president as to whether or not he wants to exercise it.""
**Thus, Trump has prepared a double whip for Russia. He promised an ""important statement"" on Russia on Monday (apparently, the White House is still considering Lavrov’s proposal on new approaches).

Overall, the situation for Russia isn’t much better than under Biden. American weapons, paid for by globalists, will keep flowing to the Armed Forces of Ukraine. The internal scheme doesn’t matter much. Having dialogue with Trump (unlike with Biden) is, of course, a positive — it reduces the risk of uncontrolled escalation. However, the factor of gradual, deliberate, Western-controlled preparation for war with Russia has not been resolved — only worsened.

Sanctions and the volume of weapons may not be critical, but the threat of a larger-scale war in the medium term has become even more pressing. So far, Russia has not proposed a way to reverse this trend of sliding toward it ☝️**",https://t.me/zeradaglobal/4116
