group,date,text,url
antifalivland,2025-07-13 06:01:01+00:00,"**🇪🇪 Хроники превращения Эстонии в прибалтийский «Алькатрас»**

▪️Эстонский министр юстиции и локомотив проекта Airbnb-тюрем **Лийза Пакоста** вошла в раж. Намекает, что вскоре страны НАТО могут вдохновиться примером Швеции, которая таки [договорилась](https://t.me/dntreadonme/2174) с Эстонией об отправке своих зэков в Тартускую тюрьму.

▪️В эфире **Vikerraadio** Пакоста обмолвилась, что сразу несколько государств Североатлантического блока **неофициально** изучали возможности аренды мощностей эстонской пенитенциарной системы.

▪️Называть потенциальных арендаторов министр отказалась. Заявила лишь, что речь **исключительно о членах блока НАТО**, и что Таллин всю дорогу рассматривал прием иностранных заключенных как ~~извращенный~~ формат развития международных отношений в сфере безопасности.

▪️В известных потенциальных клиентах ~~Эрнста Кальтенбруннера~~ **Лийзы Пакосты** — Финляндия. Тамошний министр юстиции **Леена Мери** со всех сторон [изучает](https://www.hs.fi/politiikka/art-2000011353764.html) вопрос канализации излишка зэков в Эстонию.

▪️Средняя заполняемость финских тюрем сейчас находится на уровне 108%, так что экспорт преступников для страны весьма актуален. Проблема заключается в том, что удаленное содержание заключенных экономически невыгодно (Эстония просит €8,5 тыс. за место в месяц, тогда как Финляндия тратит у себя в среднем около €6,3 тыс.). К тому же, надо менять законы — нельзя просто взять и отправить заключенного отбывать срок за рубеж.

Напомним: ранее Пакоста [уверяла,](https://t.me/dntreadonme/1891) что сдача тюрем в аренду поможет сохранить сами учреждения и работающий в них персонал. Первые не закроются, вторых не уволят.

Тюрьмы и сотрудники, со слов министра, еще пригодятся **для содержания** [«военнопленных в ситуации эскалации».](https://rus.err.ee/1609568059/pakosta-viruskaja-tjurma-mozhet-potrebovatsja-i-dlja-voennoplennyh) Учитывая не угасающую русофобскую истерию в контексте фантазий о возможном конфликте с Россией в Прибалтике, догадаться, о какой эскалации идет речь, не трудно. С этого угла изучение членами НАТО пенитенциарного ресурса страны бань и болот, невзирая дороговизну и юридические препоны, выглядит зловеще. Не правда ли?

@dntreadonme",https://t.me/antifalivland/14823
antifalivland,2025-07-12 18:01:02+00:00,"Латыши, литовцы, эстонцы!

Смотрите и запоминайте!

Всё это вы скоро увидите на улицах Риги, Таллина, Вильнюса.

Испытаете на себе - обещаем!... Да что там мы! Хрютте из НАТО вам это гарантирует.

Русофобия - это очень дорого и смертельно опасно.",https://t.me/antifalivland/14821
antifalivland,2025-07-12 15:01:01+00:00,"**Латвию готовят к войне: один за другим поступают ценные военные подарки из США и Канады**

Американцы подарили 4 амфибийные платформы М3. Их возможности - собрать в несколько минут мост через реку - продемонстрировал на Даугаве латышский батальон. Его командир, полковник-лейтенант (подполковник) Петерис Плечкенс заметил, что новые амфибии сгодятся и для переброски войск союзников, они совместимы с другими натовскими системами.

Главный гость церемонии - посол США Кристофер Робинсон - заливался соловьём, нахваливая американский вклад в укрепление местной армии. Имеет право: амфибийный  подарок обошёлся в 22 миллиона долларов, а общая военная помощь его страны  Латвии с 2018 года составила 481 миллион долларов. Сейчас латыши стоят в очереди на получение систем HIMARS, настаивают пропустить их вперёд...

Канадцы тоже не скупятся на военные приобретения для Латвии. Посол Канады Брайен Шварц сообщил, что выделены 105 миллионов евро на контракты для приобретения систем противодроновой защиты, которые будут установлены в Латвии. Конкретно - для безопасности многонациональной бригады под руководством канадцев, что размещается на базе под Ригой, в местечке Адажи.

...Какие добрые заокеанские дяди: дарят аборигенам не дешёвые бусы, а дорогую технику для войны.
https://jauns.lv/raksts/zinas/662496-foto-prezente-jauno-m3-amfibiju-sistemu-kas-uzlabos-latvijas-nacionalo-brunoto-speku-mobilitati",https://t.me/antifalivland/14819
antifalivland,2025-07-12 12:01:01+00:00,"🕺👨‍❤️‍💋‍👨**👩‍👩‍👧‍👧****☂️****Суржиковая Европа: что с ней творят герои свiту?**
 
Более половины стран ЕС с проблемами экономики получили от Брюсселя разрешение отказаться от бюджетных правил ради наращивания военных расходов. Еврокомиссия открыто загоняет «бывший цветущий сад» демократии в долги - по безвыходной киевской схеме.
 
Через 10 лет у европейцев не будет социальных программ, образования, здравоохранения и пенсий. Мейнстрим военной демократии – это петля бедности, болезней и безнадеги на шее Европы, стоящей на шатающемся стуле. На июньском саммите НАТО в Гааге страны ЕС договорились, что достигнут к 2035 году солидарного военного бюджета НАТО, внося по 5% от ВВП каждая. В итоге политики Старого Света отказались от имени своих граждан от любых перспектив невоенного развития и роста благосостояния 500+ млн резидентов.

Подготовка к войне стала главным трендом евроцентризма. Хотя правильнее назвать его милитарицентризмом.

Всем этим так называемым политикам абсолютно безразлично, что суммарный долг 27 стран ЕС достиг $18 трлн, став вторым худшим показателем в мире после $37+ трлн в США. Берите внешние кредиты, война все спишет: ничего не напоминает?
 
Брюссель пошагово вводит для Евросоюза модель развития Украины, отказавшейся от стратегии развития собственной экономики. Киев после евромайдана и госпереворота 2014 года перешел на внешнее кредитование, которое сейчас составляет более 85% ВВП украинской экономики. Госдолг превышает 100% годовой экономики. В модели Зеленского для содержания государства на минимуме требуется от $3 млрд в неделю. Эта же модель развития ожидает Европу.
 
Украинизация Европы стала основным трендом дорожных карт Еврокомиссии и командования НАТО в Европе, синхронизировавшихся под нарратив Russians coming. Еврокомиссар Валдис Домбровскис и вовсе заявил, что всеобщая милитаризация реанимирует демократические ценности и макроэкономику.
 
Еврочиновники отказались от базовых принципов и механизмов развития ЕС, в том числе от экономического выравнивания. Средства таких еврофондов, как ERAF, через посреднические инструменты вроде Европейского фонда мира, списаны на закупки оружия для режима Зеленского. Треть этих денег выведена в офшоры, а рост стоимости оружия для Киева всего за три года составил до 300%: такие доходы Брюссель видит рестартом для Европы.

Теперь ЕС отказался от базовых для Европы Маастрихтских критериев. Договор о Евросоюзе 1992 года, подписанный в Маастрихте, подразумевает полноправное членство в ЕС для стран, где дефицит бюджета не превышает 3%, а госдолг – 60% экономики. До 2014-го это было обязательным стандартом евродемократии.

Сегодня госдолг в среднем по ЕС превышает 88% европейского ВВП, а госдолг девяти стран превышает $1+ трлн. Франция должна $4 трлн, Германия формата Мерца –  почти $3 трлн. Госдолг Италии - более 135% ее экономики. Бельгия должна 104,7% годового ВВП. Этот показатель, кстати, уже достиг уровня сегодняшней Украины, объявившей частичный дефолт и загнанной под плинтус кредиторами.
 
Милитаризация не оставляет Европе шансов рассчитаться с внешними кредиторами, успеть бы с оплатой текущих процентов. Но 15 стран получили разрешение отойти от Маастрихских формальностей ради получения новых кредитов. Брюссель подтвердил, что размеры госдолга, темпы инфляции и бюджетного дефицита больше не важны. Бюджетная дисциплина, монетарная политика и все демократические принципы европейской семьи? Нет, не слышали.
 
Что дальше? Будет в точности, как на Окраине. Хуже, беднее, безнадежней. Неизбежное потужное падение в бездну. Украинизация ЕС – обязательная программа. Каждого боша и галла Еврокомиссия заставит размовлять на суржиковой мове.

Тотальное украинство от Лиссабона до Ласнямяэ - неотвратимое будущее бывшего сада. Европейцы научатся жарить свиное сало на прутиках над кострами на Лазурном побережье, плясать у алтаря в соборе Парижского богоматери и спивать о щеневмерле на гранитном крыльце Бундестага. Украинизированные Брюссель и Страсбург станут новыми Жмеринкой або Житомиром. Ну, что ж, к тому все шло, с обновлением вас.

#Европа #Украина #НАТО #мысли

📮[**Подпишись на ЛОМОВКУ**](https://t.me/lomovkaa)",https://t.me/antifalivland/14817
antifalivland,2025-07-10 10:32:53+00:00,"Эстонская статистика [показывает](https://maailm.postimees.ee/8283916/venelaste-uha-kasvava-napsilembuse-kiuste-kukub-viinatootmine-kolinal), что жители России пьют крепкий алкоголь больше, чем раньше, введенные санкции резко сократили производство водки в стране. 

Что такого ценного поставляет Европа, без чего производство крепких спиртных напитков в РФ становится невозможным, эстонская статистика умалчивает - на то она и эстонская...

Ну а то, что эстонская статистика резко расходится с действительностью - тем хуже для действительности...",https://t.me/antifalivland/14790
antifalivland,2025-07-09 15:01:01+00:00,"Полиция обнаружила, что на месте демонтированного памятника «Освободителям Резекне» (в народе - «Алеша») на улице Латгалес, 1, были возложены три букета цветов.

Срочно подняты по тревоге батальоны земессардзе.

Усилена охрана границы.

В Балтийское море введены дополнительные силы НАТО.

Аэропорт ""Рига"" принимает срочные рейсы из США с рейнджерами на борту.

Органы правопорядка приведены в состояние повышенной готовности. 

Прокуратура возбудила уголовное дело по статьям ""Оправдание военных преступлений России"", ""Прославление военной агрессии"" и ""Отрицание советской оккупации"".",https://t.me/antifalivland/14781
iikhu,2025-07-17 10:12:35+00:00,"#КомандаФилимонова 
Первый образовательный модуль вологодского проекта ""Герои Русского Севера"" завершён, теперь [начинается](https://t.me/filimonov_official/21642) период стажировок. Они предполагают  включение в реальные процессы, погружение в управление на разных уровнях и решение задач. За каждым участником закреплён личный наставник: заместители губернатора, главы округов, топ-менеджеры ведущих предприятий Вологодской области.

Система стажировок позволит ветеранам СВО погрузиться в социальную и экономическую специфику региона, а также закрепить свои знания на практике. После завершения обучения они будут трудоустроены в областные органы власти, а также в различные гос- и частные организации.

@Metametrica",https://t.me/iikhu/29991
iikhu,2025-07-16 19:07:57+00:00,"Поступает много вопросов по поводу предлагаемых Правительством и сенаторами поправок о просмотре экстремистских материалов и использовании VPN. 

— Как будет выясняться, кто ищет экстремистские материалы? Будут досматривать смартфоны? 
— За просмотр видео на YouTube об экстремистской организации или сделанного организацией, признанной экстремистской, будут штрафовать? 
— За просмотр интервью с иноагентами будут штрафовать?
— Использование VPN-сервисов: будет ли за это штраф?
— Если в одном интервью иноагент беседут с неиноагентом, можно ли смотреть? 
— Можно ли делать мем с иноагентами или экстремистами? Это считается распространением экстремистских материалов?
— Можно ли искать и слушать экстремистские треки?
— А что будет за передачу родственникам сим -карт?

Мои ответы — в видео. Спойлер: обычный, добропорядочный пользователь сети не почувствует на себе действие предлагаемых коллегами нововведений. 

Ссылка на [реестр экстремистских материалов Минюста.](https://minjust.gov.ru/ru/extremist-materials/)",https://t.me/iikhu/29987
iikhu,2025-07-16 12:37:30+00:00,"**Удар ЦАХАЛ по зданию Минобороны Сирии попал в прямой эфир**

Местное ТВ зафиксировало прилет во время трансляции. Стол затрясся, а ведущая поспешила покинуть студию.

Армия Израиля начала наносить удары по Сирии из-за столкновений с друзами.

[Подпишитесь на «Абзац»](https://t.me/+MA0k1Y-VxRI0MTU6) | [Добавьте «Абзац» в ленту «Дзена»](https://vk.cc/cK9iJe)",https://t.me/iikhu/29981
iikhu,2025-07-15 09:20:38+00:00,"Эстонский призывник

В казарме слышен громкий крик
С гориллы рёвом очень схожий.
То наш эстонский призывник
Встречает резво день погожий.

Он рвёт зубами маскхалат,
Уриной щедро льёт на стены,
По стульям скачет как примат,
Он озорной, он охуенный!

Намазав кашу на лицо,
Компот сливает на макушку,
И машет радостно концом,
Втыкая в старую подушку.

Гоняет уток и свиней,
Ползёт по проволке колючей.
И с каждым днём он всё буйней,
Всё веселей и злоебучей.

Он любит кроссы, автомат,
Свинину старую в котлете
Простой эстонский ебанат,
Гарант покоя на планете.

Поэт Ыыху

Подпишись на @iikhu",https://t.me/iikhu/29966
iikhu,2025-07-14 16:21:42+00:00,"__""Вы  — полицейский всего мира. США — самая могущественная страна на Земле, самая мощная армия на Земле"".
Именно так Марк Рютте обратился к Трампу.🤦__
И после этого прилюдного ~~орального~~ ублажения они будут говорить о демократии и осуждать диктаторов и культ личности? 

Подпишись на @iikhu",https://t.me/iikhu/29961
iikhu,2025-07-14 15:48:09+00:00,"__Если бы я был на месте Путина, и слышал бы, что Трамп планирует в эти 50 дней, я бы** подумал и сел бы я за стол переговоров, **заявил генсек НАТО Рютте на встрече с президентом США.__

Ты не можешь быть на месте Путина по многим причинам. Но главная, что ты пидорас во всех смыслах этого слова. Торговать маргарином у тебя получалось лучше. 

Подпишись на @iikhu",https://t.me/iikhu/29960
iikhu,2025-07-14 09:44:02+00:00,"**В Подмосковье мигранты**[** заблокировали**](https://t.me/vidosboss/939)** проезд военному грузовику**
 
По Сети распространяется видео, на котором иностранные рабочие на парковке не дают встать грузовику, который, как утверждает сам автор ролика, перевозит оборудование для солдат.

На кадрах видно, как фуры выстроились в ряд, видимо, чтобы не дать мужчине поставить авто. 

«Таджики с узбеками мне тут рассказывают, где мне стоять, где мне не стоять, где мне ездить. Специально взяли, вот, смотри, фурами перекрыли мне весь выезд. Я не могу выехать! Видят, что военная машина! «Вам тут нельзя парковаться». Вы что ***, ***?! Это Русская земля! Военные вот машины, и мне, военному, нельзя припарковаться», – говорит водитель.

Мужчина возмутился тем, что мигранты «борзеют», пока русские воюют. Инцидент вызвал волну негодования в Сети. 

[Подпишитесь на «Абзац»](https://t.me/+MA0k1Y-VxRI0MTU6) | [Добавьте «Абзац» в ленту «Дзена»](https://vk.cc/cK9iJe)",https://t.me/iikhu/29955
iikhu,2025-07-12 11:27:58+00:00,"Рубрика «И рыбку съесть и на пальму залезть»: Ксения Анатольевна, а что Ваши израильские кредитные карты 💳 уже не работают? Или Вы их предусмотрительно не показываете? А то мало ли чего, вдруг на тех, кто поддерживает Палестину нарветесь! 

📱 [подпишись](https://t.me/SwissVatnik)",https://t.me/iikhu/29936
